"","X","author","title","year","doi","filename","n_duplicates"
"215",145,"Nocelli, R. C. F.; Soares, S. M. M.; Monquero, P. A.","EFFECTS OF HERBICIDES ON THE SURVIVAL OF THE BRAZILIAN NATIVE BEE Melipona scutellaris LATREILLE, 1811 (HYMENOPTERA: APIDAE)",2019,"10.1590/S0100-83582019370100156","wos.csv",1
"216",147,"PANKIW, T; JAY and SC","AERIALLY APPLIED ULTRA-LOW-VOLUME MALATHION EFFECTS ON COLONIES OF HONEY-BEES (HYMENOPTERA, APIDAE)",1992,"10.1093/jee/85.3.692","wos.csv",1
"217",148,"Malerbo-Souza and DT; Nogueira-Couto and RH","Efficiency of n-octyl-acetate, 2-heptanone and citronellal in repelling bees from Basil (Ocimum sellowii Labiatae)",2004,"10.1590/S1516-89132004000100016","wos.csv",1
"218",149,"Fournier and Alice; Rollin and Orianne; Le Feon and Violette; Decourtye and Axel; Henry and Mickael","Crop-Emptying Rate and the Design of Pesticide Risk Assessment Schemes in the Honey Bee and Wild Bees (Hymenoptera: Apidae)",2014,"10.1603/EC13087","wos.csv",1
"219",150,"Adhikari and Subodh; Burkle and Laura A.; O'Neill and Kevin; Weaver and David K.; Delphia and Casey M.; Menalled and Fabian","Dryland Organic Farming Partially Offsets Negative Effects of Highly Simplified Agricultural Landscapes on Forbs, Bees, and Bee-Flower Networks",2019,"10.1093/ee/nvz056","wos.csv",1
